{
  "battle_id": "phase6_forecast_strike_basic",
  "seed": 6604,
  "map": {"width": 6, "height": 6, "blocked": []},
  "units": [
    {
      "id": "fighter",
      "team": "pc",
      "hp": 30,
      "position": [1, 1],
      "initiative": 20,
      "attack_mod": 9,
      "ac": 18,
      "damage": "1d8+4"
    },
    {
      "id": "guard",
      "team": "enemy",
      "hp": 36,
      "position": [2, 1],
      "initiative": 10,
      "attack_mod": 6,
      "ac": 17,
      "damage": "1d6+3"
    }
  ],
  "commands": [
    {
      "type": "strike",
      "actor": "fighter",
      "target": "guard",
      "emit_forecast": true
    }
  ]
}
