{
  "battle_id": "phase5_temp_hp_source_policy_basic",
  "seed": 611,
  "map": {
    "width": 6,
    "height": 6,
    "blocked": []
  },
  "units": [
    {
      "id": "src_a",
      "team": "pc",
      "hp": 20,
      "position": [1, 1],
      "initiative": 20,
      "attack_mod": 4,
      "ac": 16,
      "damage": "1",
      "fortitude": 5,
      "reflex": 5,
      "will": 5
    },
    {
      "id": "src_b",
      "team": "pc",
      "hp": 20,
      "position": [1, 2],
      "initiative": 10,
      "attack_mod": 4,
      "ac": 16,
      "damage": "1",
      "fortitude": 5,
      "reflex": 5,
      "will": 5
    },
    {
      "id": "target",
      "team": "enemy",
      "hp": 20,
      "position": [2, 1],
      "initiative": 5,
      "attack_mod": 4,
      "ac": 16,
      "damage": "1",
      "fortitude": 4,
      "reflex": 4,
      "will": 4
    }
  ],
  "commands": [
    {
      "type": "apply_effect",
      "actor": "src_a",
      "target": "target",
      "effect_kind": "temp_hp",
      "payload": {
        "amount": 5
      },
      "duration_rounds": null,
      "tick_timing": null
    },
    {
      "type": "end_turn",
      "actor": "src_a"
    },
    {
      "type": "apply_effect",
      "actor": "src_b",
      "target": "target",
      "effect_kind": "temp_hp",
      "payload": {
        "amount": 9,
        "cross_source": "ignore"
      },
      "duration_rounds": null,
      "tick_timing": null
    },
    {
      "type": "apply_effect",
      "actor": "src_b",
      "target": "target",
      "effect_kind": "temp_hp",
      "payload": {
        "amount": 4,
        "cross_source": "replace"
      },
      "duration_rounds": null,
      "tick_timing": null
    }
  ]
}
