{
  "battle_id": "phase5_temp_hp_expire_basic",
  "seed": 610,
  "map": {
    "width": 6,
    "height": 6,
    "blocked": []
  },
  "units": [
    {
      "id": "buffer",
      "team": "pc",
      "hp": 20,
      "position": [1, 1],
      "initiative": 20,
      "attack_mod": 4,
      "ac": 16,
      "damage": "1",
      "fortitude": 5,
      "reflex": 5,
      "will": 5
    },
    {
      "id": "enemy",
      "team": "enemy",
      "hp": 20,
      "position": [2, 1],
      "initiative": 10,
      "attack_mod": 4,
      "ac": 16,
      "damage": "1",
      "fortitude": 4,
      "reflex": 4,
      "will": 4
    }
  ],
  "commands": [
    {
      "type": "apply_effect",
      "actor": "buffer",
      "target": "buffer",
      "effect_kind": "temp_hp",
      "payload": {
        "amount": 5,
        "remove_on_expire": true
      },
      "duration_rounds": 1,
      "tick_timing": null
    },
    {
      "type": "end_turn",
      "actor": "buffer"
    }
  ]
}
