{
  "battle_id": "hidden_pit_basic",
  "seed": 101,
  "map": {
    "width": 6,
    "height": 6,
    "blocked": [[3, 3]]
  },
  "units": [
    {
      "id": "pc_fighter",
      "team": "pc",
      "hp": 20,
      "position": [0, 0],
      "initiative": 16,
      "attack_mod": 7,
      "ac": 17,
      "damage": "1d8+4"
    },
    {
      "id": "kobold_guard",
      "team": "enemy",
      "hp": 16,
      "position": [1, 0],
      "initiative": 12,
      "attack_mod": 5,
      "ac": 15,
      "damage": "1d6+2"
    }
  ],
  "commands": [
    {"type": "strike", "actor": "pc_fighter", "target": "kobold_guard"},
    {"type": "end_turn", "actor": "pc_fighter"},
    {"type": "strike", "actor": "kobold_guard", "target": "pc_fighter"},
    {"type": "end_turn", "actor": "kobold_guard"},
    {"type": "strike", "actor": "pc_fighter", "target": "kobold_guard"},
    {"type": "end_turn", "actor": "pc_fighter"}
  ]
}
