{
  "battle_id": "phase6_cast_spell_basic",
  "seed": 6601,
  "map": {"width": 6, "height": 6, "blocked": []},
  "units": [
    {
      "id": "mage",
      "team": "pc",
      "hp": 28,
      "position": [1, 1],
      "initiative": 20,
      "attack_mod": 7,
      "ac": 16,
      "damage": "1d6+3"
    },
    {
      "id": "raider",
      "team": "enemy",
      "hp": 40,
      "position": [2, 1],
      "initiative": 10,
      "attack_mod": 6,
      "ac": 15,
      "damage": "1d8+2",
      "reflex": -10,
      "resistances": {"fire": 2}
    }
  ],
  "commands": [
    {
      "type": "cast_spell",
      "actor": "mage",
      "spell_id": "ember_burst",
      "target": "raider",
      "dc": 22,
      "save_type": "Reflex",
      "damage": "12",
      "damage_type": "fire",
      "mode": "basic"
    }
  ]
}
