{
  "battle_id": "phase5_grouped_mitigation_basic",
  "seed": 606,
  "map": {
    "width": 6,
    "height": 6,
    "blocked": []
  },
  "units": [
    {
      "id": "caster",
      "team": "pc",
      "hp": 30,
      "position": [1, 1],
      "initiative": 20,
      "attack_mod": 100,
      "ac": 18,
      "damage": "10",
      "attack_damage_type": "slashing",
      "fortitude": 6,
      "reflex": 6,
      "will": 6
    },
    {
      "id": "target_energy",
      "team": "enemy",
      "hp": 40,
      "position": [2, 1],
      "initiative": 10,
      "attack_mod": 5,
      "ac": 16,
      "damage": "1d8+2",
      "fortitude": 4,
      "reflex": -10,
      "will": 4,
      "weaknesses": {
        "energy": 2
      }
    },
    {
      "id": "target_physical",
      "team": "enemy",
      "hp": 40,
      "position": [1, 2],
      "initiative": 9,
      "attack_mod": 5,
      "ac": 10,
      "damage": "1d8+2",
      "fortitude": 4,
      "reflex": 4,
      "will": 4,
      "resistances": {
        "physical": 4
      }
    }
  ],
  "commands": [
    {
      "type": "save_damage",
      "actor": "caster",
      "target": "target_energy",
      "dc": 30,
      "save_type": "Reflex",
      "damage": "10",
      "damage_type": "fire",
      "mode": "basic"
    },
    {
      "type": "strike",
      "actor": "caster",
      "target": "target_physical"
    }
  ]
}
