{
  "battle_id": "phase5_damage_mitigation_basic",
  "seed": 801,
  "map": {
    "width": 6,
    "height": 6,
    "blocked": []
  },
  "units": [
    {
      "id": "caster",
      "team": "pc",
      "hp": 25,
      "position": [1, 1],
      "initiative": 20,
      "attack_mod": 6,
      "ac": 18,
      "damage": "1d8+2"
    },
    {
      "id": "target",
      "team": "enemy",
      "hp": 40,
      "position": [2, 1],
      "initiative": 10,
      "attack_mod": 5,
      "ac": 16,
      "damage": "1d8+2",
      "reflex": -10,
      "resistances": {
        "fire": 5
      },
      "weaknesses": {
        "fire": 3
      }
    }
  ],
  "commands": [
    {
      "type": "save_damage",
      "actor": "caster",
      "target": "target",
      "dc": 30,
      "save_type": "Reflex",
      "damage": "10",
      "damage_type": "fire",
      "mode": "basic"
    }
  ]
}
