{
  "battle_id": "phase6_use_feat_effect_basic",
  "seed": 6602,
  "map": {"width": 6, "height": 6, "blocked": []},
  "units": [
    {
      "id": "bard",
      "team": "pc",
      "hp": 24,
      "position": [1, 1],
      "initiative": 20,
      "attack_mod": 6,
      "ac": 16,
      "damage": "1d6+2"
    },
    {
      "id": "ally",
      "team": "pc",
      "hp": 22,
      "position": [1, 2],
      "initiative": 12,
      "attack_mod": 5,
      "ac": 15,
      "damage": "1d6+2"
    },
    {
      "id": "skirmisher",
      "team": "enemy",
      "hp": 20,
      "position": [4, 4],
      "initiative": 10,
      "attack_mod": 5,
      "ac": 14,
      "damage": "1d6+2"
    }
  ],
  "commands": [
    {
      "type": "use_feat",
      "actor": "bard",
      "feat_id": "inspiring_chorus",
      "target": "ally",
      "effect_kind": "temp_hp",
      "payload": {
        "amount": 4,
        "source_key": "feat:inspiring_chorus"
      },
      "duration_rounds": 2,
      "tick_timing": "turn_end"
    }
  ]
}
