{
  "battle_id": "phase5_temp_hp_basic",
  "seed": 608,
  "map": {
    "width": 6,
    "height": 6,
    "blocked": []
  },
  "units": [
    {
      "id": "attacker",
      "team": "pc",
      "hp": 25,
      "position": [1, 1],
      "initiative": 20,
      "attack_mod": 100,
      "ac": 18,
      "damage": "10",
      "attack_damage_type": "slashing",
      "fortitude": 6,
      "reflex": 6,
      "will": 6
    },
    {
      "id": "target",
      "team": "enemy",
      "hp": 40,
      "temp_hp": 4,
      "position": [2, 1],
      "initiative": 10,
      "attack_mod": 5,
      "ac": 10,
      "damage": "1d8+2",
      "fortitude": 4,
      "reflex": 4,
      "will": 4
    }
  ],
  "commands": [
    {
      "type": "strike",
      "actor": "attacker",
      "target": "target"
    }
  ]
}
