{
  "battle_id": "m3_trigger_hazard_source_basic",
  "seed": 777,
  "map": {
    "width": 8,
    "height": 8,
    "blocked": []
  },
  "units": [
    {
      "id": "hazard_core",
      "team": "hazard",
      "hp": 999,
      "position": [3, 3],
      "initiative": 20,
      "attack_mod": 0,
      "ac": 10,
      "damage": "1d1",
      "fortitude": 0,
      "reflex": 0,
      "will": 0
    },
    {
      "id": "pc_1",
      "team": "pc",
      "hp": 30,
      "position": [3, 4],
      "initiative": 12,
      "attack_mod": 7,
      "ac": 17,
      "damage": "1d8+3",
      "fortitude": 7,
      "reflex": 4,
      "will": 3
    },
    {
      "id": "pc_2",
      "team": "pc",
      "hp": 30,
      "position": [4, 4],
      "initiative": 10,
      "attack_mod": 6,
      "ac": 16,
      "damage": "1d8+3",
      "fortitude": 6,
      "reflex": 8,
      "will": 5
    }
  ],
  "commands": [
    {
      "type": "trigger_hazard_source",
      "actor": "hazard_core",
      "hazard_id": "fireball-rune",
      "source_name": "Fireball",
      "source_type": "trigger_action",
      "center_x": 3,
      "center_y": 4
    },
    {
      "type": "end_turn",
      "actor": "hazard_core"
    }
  ]
}
