{
  "battle_id": "phase5_affliction_mitigation_basic",
  "seed": 613,
  "map": {
    "width": 6,
    "height": 6,
    "blocked": []
  },
  "units": [
    {
      "id": "caster",
      "team": "pc",
      "hp": 25,
      "position": [1, 1],
      "initiative": 20,
      "attack_mod": 6,
      "ac": 18,
      "damage": "1d8+2",
      "fortitude": 5,
      "reflex": 5,
      "will": 5
    },
    {
      "id": "target",
      "team": "enemy",
      "hp": 20,
      "position": [2, 1],
      "initiative": 10,
      "attack_mod": 5,
      "ac": 16,
      "damage": "1d8+2",
      "fortitude": 4,
      "reflex": 4,
      "will": 4,
      "resistances": {
        "poison": 4
      },
      "weaknesses": {
        "poison": 1
      }
    }
  ],
  "commands": [
    {
      "type": "apply_effect",
      "actor": "caster",
      "target": "target",
      "effect_kind": "affliction",
      "payload": {
        "name": "poison_mitigation_test",
        "maximum_duration": {
          "amount": 2,
          "unit": "round"
        },
        "stages": [
          {
            "stage": 1,
            "damage": [
              {
                "formula": "10",
                "damage_type": "poison"
              }
            ],
            "conditions": [],
            "duration": {
              "amount": 1,
              "unit": "round"
            }
          }
        ],
        "current_stage": 1
      },
      "duration_rounds": 2,
      "tick_timing": "turn_end"
    }
  ]
}
