{
  "battle_id": "poisoned_dart_gallery_basic",
  "seed": 303,
  "map": {
    "width": 7,
    "height": 7,
    "blocked": [[2, 2], [2, 3], [2, 4]]
  },
  "units": [
    {
      "id": "pc_ranger",
      "team": "pc",
      "hp": 18,
      "position": [0, 3],
      "initiative": 15,
      "attack_mod": 7,
      "ac": 16,
      "damage": "1d6+4"
    },
    {
      "id": "dungeon_slime",
      "team": "enemy",
      "hp": 19,
      "position": [1, 3],
      "initiative": 10,
      "attack_mod": 4,
      "ac": 14,
      "damage": "1d6+1"
    }
  ],
  "commands": [
    {"type": "strike", "actor": "pc_ranger", "target": "dungeon_slime"},
    {"type": "end_turn", "actor": "pc_ranger"},
    {"type": "strike", "actor": "dungeon_slime", "target": "pc_ranger"},
    {"type": "end_turn", "actor": "dungeon_slime"},
    {"type": "strike", "actor": "pc_ranger", "target": "dungeon_slime"},
    {"type": "end_turn", "actor": "pc_ranger"}
  ]
}
