{
  "battle_id": "phase5_persistent_recovery_basic",
  "seed": 802,
  "map": {
    "width": 6,
    "height": 6,
    "blocked": []
  },
  "units": [
    {
      "id": "pc",
      "team": "pc",
      "hp": 20,
      "position": [1, 1],
      "initiative": 20,
      "attack_mod": 6,
      "ac": 16,
      "damage": "1d8+3"
    },
    {
      "id": "enemy",
      "team": "enemy",
      "hp": 18,
      "position": [2, 1],
      "initiative": 10,
      "attack_mod": 5,
      "ac": 15,
      "damage": "1d6+2",
      "resistances": {
        "fire": 1
      }
    }
  ],
  "commands": [
    {
      "type": "apply_effect",
      "actor": "pc",
      "target": "enemy",
      "effect_kind": "persistent_damage",
      "payload": {
        "formula": "1d1",
        "damage_type": "fire",
        "recovery_dc": 1
      },
      "duration_rounds": 10,
      "tick_timing": "turn_start"
    },
    {
      "type": "end_turn",
      "actor": "pc"
    }
  ]
}
